code,presence,cross_industry_name,life_science_name,retail_name,level,name_match,category
7.6.7,CI LS RT,Relocate employees and manage assignments,Relocate employees and manage assignments,Relocate employees and manage assignments,3,ALL_IDENTICAL,UNIVERSAL
7.6.7.1,CI LS RT,Manage expatriates,Manage expatriates,Manage expatriates,4,ALL_IDENTICAL,UNIVERSAL
7.7,CI LS RT,Manage employee information and analytics,Manage employee information and analytics,Manage employee information and analytics,2,ALL_IDENTICAL,UNIVERSAL
7.7.1,CI LS RT,Manage reporting processes,Manage reporting processes,Manage reporting processes,3,ALL_IDENTICAL,UNIVERSAL
7.7.2,CI LS RT,Manage employee inquiry process,Manage employee inquiry process,Manage employee inquiry process,3,ALL_IDENTICAL,UNIVERSAL
7.7.3,CI LS RT,Manage and maintain employee data,Manage and maintain employee data,Manage and maintain employee data,3,ALL_IDENTICAL,UNIVERSAL
7.7.4,CI LS RT,Manage human resource information systems HRIS,Manage human resource information systems HRIS,Manage human resource information systems HRIS,3,ALL_IDENTICAL,UNIVERSAL
7.7.5,CI LS RT,Develop and manage employee measures,Develop and manage employee metrics,Develop and manage employee metrics,3,DIFFERENT,UNIVERSAL
7.7.6,CI LS RT,Develop and manage time and attendance systems,Develop and manage time and attendance systems,Develop and manage time and attendance systems,3,ALL_IDENTICAL,UNIVERSAL
7.7.7,CI LS RT,Develop workforce analytics,Manage/Collect employee suggestions and perform employee research,Manage/Collect employee suggestions and perform employee research,3,DIFFERENT,UNIVERSAL
7.7.7.1,CI,Determine stakeholder requirements,,,4,,CI_SPECIFIC
7.7.7.2,CI,Identify research questions,,,4,,CI_SPECIFIC
7.7.7.3,CI,Select workforce analysis methodology,,,4,,CI_SPECIFIC
7.7.7.4,CI,Identify workforce data sources,,,4,,CI_SPECIFIC
7.7.7.5,CI,Gather workforce data,,,4,,CI_SPECIFIC
7.7.8,CI,Implement workforce analytics,,,3,,CI_SPECIFIC
7.7.8.1,CI,Transform workforce analysis data,,,4,,CI_SPECIFIC
7.7.8.2,CI,Develop insights into workforce analytics outcomes,,,4,,CI_SPECIFIC
7.7.8.3,CI,Communicate workforce analysis outcomes,,,4,,CI_SPECIFIC
7.7.9,CI,Manage/Collect employee suggestions and perform employee research,,,3,,CI_SPECIFIC
7.8,CI LS RT,Manage employee communication,Manage employee communication,Manage employee communication,2,ALL_IDENTICAL,UNIVERSAL
7.8.1,CI LS RT,Develop employee communication plan,Develop employee communication plan,Develop employee communication plan,3,ALL_IDENTICAL,UNIVERSAL
7.8.2,CI LS RT,Conduct employee engagement surveys,Conduct employee engagement surveys,Conduct employee engagement surveys,3,ALL_IDENTICAL,UNIVERSAL
7.8.3,CI,Deliver employee communications,,,3,,CI_SPECIFIC
7.9,LS RT,,Deliver employee communications,Deliver employee communications,2,LS_RT_MATCH,LS_RETAIL_ONLY
8.0,CI LS RT,Manage Information Technology (IT),Manage Information Technology (IT),Manage Information Technology (IT),1,ALL_IDENTICAL,UNIVERSAL
8.1,CI LS RT,Develop and manage IT customer relationships,Develop and manage IT customer relationships,Develop and manage IT customer relationships,2,ALL_IDENTICAL,UNIVERSAL
8.1.1,CI LS RT,Understand IT customer needs,Understand IT customer needs,Understand IT customer needs,3,ALL_IDENTICAL,UNIVERSAL
8.1.1.1,CI LS RT,Understand IT customer communities,Understand IT customer communities,Understand IT customer communities,4,ALL_IDENTICAL,UNIVERSAL
8.1.1.2,CI LS RT,Assess IT customer operational capabilities,Assess IT customer operational capabilities,Assess IT customer operational capabilities,4,ALL_IDENTICAL,UNIVERSAL
8.1.2,CI LS RT,Identify IT customer transformation needs,Identify IT customer transformation needs,Identify IT customer transformation needs,3,ALL_IDENTICAL,UNIVERSAL
8.1.2.1,CI LS RT,Understand business requirements for IT capabilities,Understand business requirements for IT capabilities,Understand business requirements for IT capabilities,4,ALL_IDENTICAL,UNIVERSAL
8.1.2.2,CI LS RT,Understand IT landscape,Understand IT landscape,Understand IT landscape,4,ALL_IDENTICAL,UNIVERSAL
8.1.2.3,CI LS RT,Develop IT visioning,Develop IT visioning,Develop IT visioning,4,ALL_IDENTICAL,UNIVERSAL
8.1.2.4,CI LS RT,Outline IT service expectations,Outline IT service expectations,Outline IT service expectations,4,ALL_IDENTICAL,UNIVERSAL
8.1.3,CI LS RT,Plan and communicate IT services,Plan and communicate IT services,Plan and communicate IT services,3,ALL_IDENTICAL,UNIVERSAL
8.1.3.1,CI LS RT,Manage IT customer expectations,Manage IT customer expectations,Manage IT customer expectations,4,ALL_IDENTICAL,UNIVERSAL
8.1.3.2,CI LS RT,Define future IT services,Define future IT services,Define future IT services,4,ALL_IDENTICAL,UNIVERSAL
8.1.3.3,CI LS RT,Determine IT performance indicators,Determine  IT performance indicators,Determine  IT performance indicators,4,DIFFERENT,UNIVERSAL
8.1.3.4,CI LS RT,Create IT marketing messages,Create IT marketing messages,Create IT marketing messages,4,ALL_IDENTICAL,UNIVERSAL
8.1.3.5,CI LS RT,Create IT service marketing plan,Create IT service marketing plan,Create IT service marketing plan,4,ALL_IDENTICAL,UNIVERSAL
8.1.4,CI LS RT,Provide IT transformation guidance,Provide IT transformation guidance,Provide IT transformation guidance,3,ALL_IDENTICAL,UNIVERSAL
8.1.4.1,CI LS RT,Develop IT transformation plans,Develop IT transformation plans,Develop IT transformation plans,4,ALL_IDENTICAL,UNIVERSAL
8.1.4.2,CI LS RT,Collect IT customer requirements,Collect IT customer requirements,Collect IT customer requirements,4,ALL_IDENTICAL,UNIVERSAL
8.1.4.3,CI LS RT,Analyze IT customer requirements,Analyze IT customer requirements,Analyze IT customer requirements,4,ALL_IDENTICAL,UNIVERSAL
8.1.4.4,CI LS RT,Identify and prioritize IT opportunities,Identify and prioritize IT opportunities,Identify and prioritize IT opportunities,4,ALL_IDENTICAL,UNIVERSAL
8.1.4.5,CI LS RT,Facilitate solution design activities,Facilitate solution design activities,Facilitate solution design activities,4,ALL_IDENTICAL,UNIVERSAL
8.1.4.6,CI LS RT,Prioritize IT outcomes,Prioritize IT outcomes,Prioritize IT outcomes,4,ALL_IDENTICAL,UNIVERSAL
8.1.4.7,CI LS RT,Develop business cases,Develop business cases,Develop business cases,4,ALL_IDENTICAL,UNIVERSAL
8.1.4.8,CI LS RT,Support business case,Support business case,Support business case,4,ALL_IDENTICAL,UNIVERSAL
8.1.4.9,CI LS RT,Develop transformation roadmap,Develop transformation roadmap,Develop transformation roadmap,4,ALL_IDENTICAL,UNIVERSAL
8.1.5,CI LS RT,Develop and manage IT service levels,Develop and manage IT service levels,Develop and manage IT service levels,3,ALL_IDENTICAL,UNIVERSAL
8.1.5.1,CI LS RT,Understand IT service requirements,Understand IT service requirements,Understand IT service requirements,4,ALL_IDENTICAL,UNIVERSAL
8.1.5.2,CI LS RT,Forecast IT service demand,Forecast IT service demand,Forecast IT service demand,4,ALL_IDENTICAL,UNIVERSAL
8.1.5.3,CI LS RT,Maintain IT services catalog,Maintain IT services catalog,Maintain IT services catalog,4,ALL_IDENTICAL,UNIVERSAL
8.1.5.4,CI LS RT,Define service level agreement,Define service level agreement,Define service level agreement,4,ALL_IDENTICAL,UNIVERSAL
8.1.5.5,CI LS RT,Maintain IT customer contracts,Maintain IT customer contracts,Maintain IT customer contracts,4,ALL_IDENTICAL,UNIVERSAL
8.1.5.6,CI LS RT,Negotiate and establish service level agreements,Negotiate and establish service level agreements,Negotiate and establish service level agreements,4,ALL_IDENTICAL,UNIVERSAL
8.1.5.7,CI LS RT,Develop and maintain improvement processes,Develop and maintain improvement processes,Develop and maintain improvement processes,4,ALL_IDENTICAL,UNIVERSAL
8.1.6,CI LS RT,Manage IT customer relationships,Manage IT customer relationships,Manage IT customer relationships,3,ALL_IDENTICAL,UNIVERSAL
8.1.6.1,CI LS RT,Establish relationship management mechanisms,Establish relationship management mechanisms,Establish relationship management mechanisms,4,ALL_IDENTICAL,UNIVERSAL
8.1.6.2,CI LS RT,Understand IT customer strategy,Understand IT customer strategy,Understand IT customer strategy,4,ALL_IDENTICAL,UNIVERSAL
8.1.6.3,CI LS RT,Understand IT customer environment,Understand  IT customer environment,Understand  IT customer environment,4,DIFFERENT,UNIVERSAL
8.1.6.4,CI LS RT,Communicate IT capabilities,Communicate IT capabilities,Communicate IT capabilities,4,ALL_IDENTICAL,UNIVERSAL
8.1.6.5,CI LS RT,Manage IT requirements,Manage IT requirements,Manage IT requirements,4,ALL_IDENTICAL,UNIVERSAL
8.1.7,CI LS RT,Analyze service performance,Analyze service performance,Analyze service performance,3,ALL_IDENTICAL,UNIVERSAL
8.1.7.1,CI LS RT,Assess SLA compliance,Assess SLA compliance,Assess SLA compliance,4,ALL_IDENTICAL,UNIVERSAL
8.1.7.2,CI LS RT,Triage SLA compliance issues,Triage SLA compliance issues,Triage SLA compliance issues,4,ALL_IDENTICAL,UNIVERSAL
8.1.7.3,CI LS RT,Collect feedback about IT products and services,Collect feedback about IT products and services,Collect feedback about IT products and services,4,ALL_IDENTICAL,UNIVERSAL
8.1.7.4,CI LS RT,Synthesize and distribute IT performance information,Synthesize and distribute IT performance information,Synthesize and distribute IT performance information,4,ALL_IDENTICAL,UNIVERSAL
8.2,CI LS RT,Develop and manage IT business strategy,Develop and manage IT business strategy,Develop and manage IT business strategy,2,ALL_IDENTICAL,UNIVERSAL
8.2.1,CI LS RT,Define business technology and governance strategy,Define business technology and governance strategy,Define business technology and governance strategy,3,ALL_IDENTICAL,UNIVERSAL
8.2.1.1,CI LS RT,Build and maintain IT strategic intelligence,Build and maintain IT strategic intelligence,Build and maintain IT strategic intelligence,4,ALL_IDENTICAL,UNIVERSAL
8.2.1.2,CI LS RT,Monitor and map current and emerging technologies,Monitor and map current and emerging technologies,Monitor and map current and emerging technologies,4,ALL_IDENTICAL,UNIVERSAL
8.2.1.3,CI LS RT,Define and communicate digital transformation strategy,Define and communicate digital transformation strategy,Define and communicate digital transformation strategy,4,ALL_IDENTICAL,UNIVERSAL
8.2.1.4,CI LS RT,Develop IT strategic alignment,Develop IT strategic alignment,Develop IT strategic alignment,4,ALL_IDENTICAL,UNIVERSAL
8.2.1.5,CI LS RT,Articulate IT alignment principles,Articulate IT alignment principles,Articulate IT alignment principles,4,ALL_IDENTICAL,UNIVERSAL
8.2.1.6,CI LS RT,Maintain IT strategic alignment,Maintain IT strategic alignment,Maintain IT strategic alignment,4,ALL_IDENTICAL,UNIVERSAL
8.2.2,CI LS RT,Manage IT portfolio strategy,Manage IT portfolio strategy,Manage IT portfolio strategy,3,ALL_IDENTICAL,UNIVERSAL
8.2.2.1,CI LS RT,Establish and validate IT value criteria,Establish and validate IT value criteria,Establish and validate IT value criteria,4,ALL_IDENTICAL,UNIVERSAL
8.2.2.2,CI LS RT,Determine IT portfolio investment balance,Determine IT portfolio investment balance,Determine IT portfolio investment balance,4,ALL_IDENTICAL,UNIVERSAL
8.2.2.3,CI LS RT,Evaluate proposed IT investment projects,Evaluate  proposed IT investment projects,Evaluate  proposed IT investment projects,4,DIFFERENT,UNIVERSAL
8.2.2.4,CI LS RT,Prioritize IT projects,Prioritize IT projects,Prioritize IT projects,4,ALL_IDENTICAL,UNIVERSAL
8.2.2.5,CI LS RT,Align IT resources to strategic priorities,Align IT resources to strategic priorities,Align IT resources to strategic priorities,4,ALL_IDENTICAL,UNIVERSAL
8.2.2.6,CI LS RT,Align IT portfolio to business objectives,Align IT portfolio to business objectives,Align IT portfolio to business objectives,4,ALL_IDENTICAL,UNIVERSAL
8.2.3,CI LS RT,Define and maintain enterprise architecture,Define and maintain enterprise architecture,Define and maintain enterprise architecture,3,ALL_IDENTICAL,UNIVERSAL
8.2.3.1,CI LS RT,Create and publish enterprise architecture principles,Create and publish enterprise architecture principles,Create and publish enterprise architecture principles,4,ALL_IDENTICAL,UNIVERSAL
8.2.3.2,CI LS RT,Establish and operate enterprise architecture governance,Establish and operate enterprise architecture governance,Establish and operate enterprise architecture governance,4,ALL_IDENTICAL,UNIVERSAL
8.2.3.3,CI LS RT,Research technologies to innovate IT services and solutions,Research technologies to innovate IT services and solutions,Research technologies to innovate IT services and solutions,4,ALL_IDENTICAL,UNIVERSAL
8.2.3.4,CI LS RT,Provide input to definition and prioritization of IT projects,Provide input to definition and prioritization of IT projects,Provide input to definition and prioritization of IT projects,4,ALL_IDENTICAL,UNIVERSAL
8.2.4,CI LS RT,Define IT service management strategy,Define IT service management strategy,Define IT service management strategy,3,ALL_IDENTICAL,UNIVERSAL
8.2.4.1,CI LS RT,Establish IT service management strategy and goals,Establish  IT service management strategy and goals,Establish  IT service management strategy and goals,4,DIFFERENT,UNIVERSAL
8.2.4.2,CI LS RT,Identify IT service operating and process requirements,Identify  IT service operating and process requirements,Identify  IT service operating and process requirements,4,DIFFERENT,UNIVERSAL
8.2.4.3,CI LS RT,Define IT service catalog,Define IT service catalog,Define IT service catalog,4,ALL_IDENTICAL,UNIVERSAL
8.2.4.4,CI LS RT,Establish IT service management framework,Establish IT service management framework,Establish IT service management framework,4,ALL_IDENTICAL,UNIVERSAL
8.2.4.5,CI LS RT,Define and implement IT service management,Define and implement IT service management,Define and implement IT service management,4,ALL_IDENTICAL,UNIVERSAL
8.2.4.6,CI LS RT,Define and deploy support service management process tools and methods,Define and deploy support service management process tools and methods,Define and deploy support service management process tools and methods,4,ALL_IDENTICAL,UNIVERSAL
8.2.4.7,CI LS RT,Monitor and report IT performance,Monitor and report IT performance,Monitor and report IT performance,4,ALL_IDENTICAL,UNIVERSAL
8.2.5,CI LS RT,Control IT management system,Control IT management system,Control IT management system,3,ALL_IDENTICAL,UNIVERSAL
8.2.5.1,CI LS RT,Determine IT performance measures,Determine IT performance measures,Determine IT performance measures,4,ALL_IDENTICAL,UNIVERSAL
8.2.5.2,CI LS RT,Define IT control points and assurance procedures governance model,Define IT control points and assurance procedures governance model,Define IT control points and assurance procedures governance model,4,ALL_IDENTICAL,UNIVERSAL
8.2.5.3,CI LS RT,Monitor and analyze overall IT performance,Monitor and analyze overall IT performance,Monitor and analyze overall IT performance,4,ALL_IDENTICAL,UNIVERSAL
8.2.5.4,CI LS RT,Monitor and analyze IT financial performance,Monitor and analyze IT financial performance,Monitor and analyze IT financial performance,4,ALL_IDENTICAL,UNIVERSAL
8.2.5.5,CI LS RT,Monitor and analyze IT value and benefits,Monitor and analyze IT value and benefits,Monitor and analyze IT value and benefits,4,ALL_IDENTICAL,UNIVERSAL
8.2.5.6,CI LS RT,Optimize IT resource allocation,Optimize IT resource allocation,Optimize IT resource allocation,4,ALL_IDENTICAL,UNIVERSAL
8.2.5.7,CI LS RT,Manage IT projects and services interdependencies,Manage IT projects and services interdependencies,Manage IT projects and services interdependencies,4,ALL_IDENTICAL,UNIVERSAL
8.2.5.8,CI LS RT,Report IT service and project performance,Report  IT service and project performance,Report  IT service and project performance,4,DIFFERENT,UNIVERSAL
8.2.5.9,CI LS RT,"Select, deploy, and operate IT performance analytics tools","Select, deploy, and operate IT performance analytics tools","Select, deploy, and operate IT performance analytics tools",4,ALL_IDENTICAL,UNIVERSAL
8.2.6,CI LS RT,Manage IT value portfolio,Manage IT value portfolio,Manage IT value portfolio,3,ALL_IDENTICAL,UNIVERSAL
8.2.6.1,CI LS RT,Assess performance against IT service and project value criteria,Assess performance against IT service and project value criteria,Assess performance against IT service and project value criteria,4,ALL_IDENTICAL,UNIVERSAL
8.2.6.2,CI LS RT,Quantify value of IT service and project portfolio investments,Quantify value of IT service and project portfolio investments,Quantify value of IT service and project portfolio investments,4,ALL_IDENTICAL,UNIVERSAL
8.2.6.3,CI LS RT,Communicate business technology value contribution,Communicate business technology value contribution,Communicate business technology value contribution,4,ALL_IDENTICAL,UNIVERSAL
8.2.6.4,CI LS RT,Determine and implement IT portfolio adjustments,Determine and implement IT portfolio adjustments,Determine and implement IT portfolio adjustments,4,ALL_IDENTICAL,UNIVERSAL
8.2.7,CI LS RT,Define and manage technology innovation,Define and manage technology innovation,Define and manage technology innovation,3,ALL_IDENTICAL,UNIVERSAL
8.2.7.1,CI LS RT,Establish selection criteria for research initiatives,Establish selection criteria for research initiatives,Establish selection criteria for research initiatives,4,ALL_IDENTICAL,UNIVERSAL
8.2.7.2,CI LS RT,Analyze emerging technology concepts,Analyze emerging technology concepts,Analyze emerging technology concepts,4,ALL_IDENTICAL,UNIVERSAL
8.2.7.3,CI LS RT,Identify technology concepts and capabilities,Identify technology concepts and capabilities,Identify technology concepts and capabilities,4,ALL_IDENTICAL,UNIVERSAL
8.2.7.4,CI LS RT,Execute IT research projects,Execute IT research projects,Execute IT research projects,4,ALL_IDENTICAL,UNIVERSAL
8.2.7.5,CI LS RT,Evaluate IT research project outcomes,Evaluate IT research project outcomes,Evaluate IT research project outcomes,4,ALL_IDENTICAL,UNIVERSAL
8.2.7.6,CI LS RT,Identify and promote viable concepts,Identify and promote viable concepts,Identify and promote viable concepts,4,ALL_IDENTICAL,UNIVERSAL
8.2.7.7,CI LS RT,Develop and plan IT investment projects,Develop and plan  IT investment projects,Develop and plan  IT investment projects,4,DIFFERENT,UNIVERSAL
8.3,CI LS RT,Develop and manage IT resilience and risk,Develop and manage IT resilience and risk,Develop and manage IT resilience and risk,2,ALL_IDENTICAL,UNIVERSAL
8.3.1,CI LS RT,"Develop IT compliance, risk, and security strategy","Develop IT compliance, risk, and security strategy","Develop IT compliance, risk, and security strategy",3,ALL_IDENTICAL,UNIVERSAL
8.3.1.1,CI LS RT,Determine and evaluate IT regulatory and audit requirements,Determine and evaluate IT regulatory and audit requirements,Determine and evaluate IT regulatory and audit requirements,4,ALL_IDENTICAL,UNIVERSAL
8.3.1.10,CI LS RT,Create IT risk mitigation strategies and approaches,Create IT risk mitigation strategies and approaches,Create IT risk mitigation strategies and approaches,4,ALL_IDENTICAL,UNIVERSAL
8.3.1.2,CI LS RT,Understand business unit risk tolerance,Understand business unit risk tolerance,Understand business unit risk tolerance,4,ALL_IDENTICAL,UNIVERSAL
8.3.1.3,CI LS RT,Establish IT risk tolerance,Establish IT risk tolerance,Establish IT risk tolerance,4,ALL_IDENTICAL,UNIVERSAL
8.3.1.4,CI LS RT,Establish risk ownership,Establish risk ownership,Establish risk ownership,4,ALL_IDENTICAL,UNIVERSAL
8.3.1.5,CI LS RT,Establish and maintain risk management roles,Establish and maintain risk management roles,Establish and maintain risk management roles,4,ALL_IDENTICAL,UNIVERSAL
8.3.1.6,CI LS RT,Establish compliance objectives,Establish compliance objectives,Establish compliance objectives,4,ALL_IDENTICAL,UNIVERSAL
8.3.1.7,CI LS RT,Identify systems to support compliance,Identify systems to support compliance,Identify systems to support compliance,4,ALL_IDENTICAL,UNIVERSAL
8.3.1.8,CI LS RT,Identify and evaluate IT risk,Identify and evaluate IT risk,Identify and evaluate IT risk,4,ALL_IDENTICAL,UNIVERSAL
8.3.1.9,CI LS RT,Evaluate IT-related risks resiliency,Evaluate  IT-related risks resiliency,Evaluate  IT-related risks resiliency,4,DIFFERENT,UNIVERSAL
8.3.2,CI LS RT,Develop IT resilience strategy,Develop IT resilience strategy,Develop IT resilience strategy,3,ALL_IDENTICAL,UNIVERSAL
8.3.2.1,CI LS RT,Determine IT delivery resiliency,Determine IT delivery resiliency,Determine IT delivery resiliency,4,ALL_IDENTICAL,UNIVERSAL
8.3.2.2,CI LS RT,Determine critical IT risks,Determine critical IT risks,Determine critical IT risks,4,ALL_IDENTICAL,UNIVERSAL
8.3.2.3,CI LS RT,Prioritize IT risks,Prioritize IT risks,Prioritize IT risks,4,ALL_IDENTICAL,UNIVERSAL
8.3.2.4,CI LS RT,Establish mitigation approaches for IT risks,Establish mitigation approaches for IT risks,Establish mitigation approaches for IT risks,4,ALL_IDENTICAL,UNIVERSAL
8.3.3,CI LS RT,"Control IT risk, compliance, and security","Control IT risk, compliance, and security","Control IT risk, compliance, and security",3,ALL_IDENTICAL,UNIVERSAL
8.3.3.1,CI LS RT,Evaluate enterprise regulatory and compliance obligations,Evaluate enterprise regulatory and compliance obligations,Evaluate enterprise regulatory and compliance obligations,4,ALL_IDENTICAL,UNIVERSAL
8.3.3.10,CI LS RT,"Identify, supervise and monitor IT risk mitigation measures","Identify, supervise and monitor IT risk mitigation measures","Identify, supervise and monitor IT risk mitigation measures",4,ALL_IDENTICAL,UNIVERSAL
8.3.3.2,CI LS RT,Analyze IT security threat impact,Analyze IT security threat impact,Analyze IT security threat impact,4,ALL_IDENTICAL,UNIVERSAL
8.3.3.3,CI LS RT,Create and maintain IT compliance requirements,Create and maintain IT compliance requirements,Create and maintain IT compliance requirements,4,ALL_IDENTICAL,UNIVERSAL
8.3.3.4,CI LS RT,"Create and maintain IT security policies, standards, and procedures","Create and maintain IT security policies, standards, and procedures","Create and maintain IT security policies, standards, and procedures",4,ALL_IDENTICAL,UNIVERSAL
8.3.3.5,CI LS RT,Develop and deploy risk management training,Develop and deploy risk management training,Develop and deploy risk management training,4,ALL_IDENTICAL,UNIVERSAL
8.3.3.6,CI LS RT,Establish risk reporting capabilities and responsibilities,Establish risk reporting capabilities and responsibilities,Establish risk reporting capabilities and responsibilities,4,ALL_IDENTICAL,UNIVERSAL
8.3.3.7,CI LS RT,Establish communication standards,Establish communication standards,Establish communication standards,4,ALL_IDENTICAL,UNIVERSAL
8.3.3.8,CI LS RT,Conduct IT risk and threat assessments,Conduct IT risk and threat assessments,Conduct IT risk and threat assessments,4,ALL_IDENTICAL,UNIVERSAL
8.3.3.9,CI LS RT,Monitor and manage IT activity risk,Monitor and manage IT activity risk,Monitor and manage IT activity risk,4,ALL_IDENTICAL,UNIVERSAL
8.3.4,CI LS RT,Plan and manage IT continuity,Plan and manage IT continuity,Plan and manage IT continuity,3,ALL_IDENTICAL,UNIVERSAL
8.3.4.1,CI LS RT,Evaluate IT continuity,Evaluate IT continuity,Evaluate IT continuity,4,ALL_IDENTICAL,UNIVERSAL
8.3.4.2,CI LS RT,Identify IT continuity gaps,Identify IT continuity gaps,Identify IT continuity gaps,4,ALL_IDENTICAL,UNIVERSAL
8.3.4.3,CI LS RT,Manage IT business continuity,Manage IT business continuity,Manage IT business continuity,4,ALL_IDENTICAL,UNIVERSAL
8.3.5,CI LS RT,"Develop and manage IT security, privacy, and data protection","Develop and manage IT security, privacy, and data protection","Develop and manage IT security, privacy, and data protection",3,ALL_IDENTICAL,UNIVERSAL
8.3.5.1,CI LS RT,Assess IT regulatory and confidentiality requirements and policies,Assess IT regulatory and confidentiality requirements and policies,Assess IT regulatory and confidentiality requirements and policies,4,ALL_IDENTICAL,UNIVERSAL
8.3.5.2,CI LS RT,"Create IT security, privacy, and data protection risk governance","Create IT security, privacy, and data protection risk governance","Create IT security, privacy, and data protection risk governance",4,ALL_IDENTICAL,UNIVERSAL
8.3.5.3,CI LS RT,"Define IT data security and privacy policies, standards, and procedures","Define IT data security and privacy policies, standards, and procedures","Define IT data security and privacy policies, standards, and procedures",4,ALL_IDENTICAL,UNIVERSAL
8.3.5.4,CI LS RT,Review and monitor physical and logical IT data security measures,Review and monitor physical and logical IT data security measures,Review and monitor physical and logical IT data security measures,4,ALL_IDENTICAL,UNIVERSAL
8.3.5.5,CI LS RT,Review and monitor application security controls,Review and monitor application security controls,Review and monitor application security controls,4,ALL_IDENTICAL,UNIVERSAL
8.3.5.6,CI LS RT,Review and monitor IT physical environment security controls,Review and monitor IT physical environment security controls,Review and monitor IT physical environment security controls,4,ALL_IDENTICAL,UNIVERSAL
8.3.5.7,CI LS RT,Monitor/analyze network intrusion detection data and resolve threats,Monitor/analyze network intrusion detection data and resolve threats,Monitor/analyze network intrusion detection data and resolve threats,4,ALL_IDENTICAL,UNIVERSAL
8.3.6,CI LS RT,Conduct and analyze IT compliance assessments,Conduct and analyze IT compliance assessments,Conduct and analyze IT compliance assessments,3,ALL_IDENTICAL,UNIVERSAL
8.3.6.1,CI LS RT,Conduct projects to enhance IT compliance and remediate risk,Conduct projects to enhance IT compliance and remediate risk,Conduct projects to enhance IT compliance and remediate risk,4,ALL_IDENTICAL,UNIVERSAL
