code,presence,cross_industry_name,life_science_name,retail_name,level,name_match,category
4.5.1,LS,,Develop Sample Delivery Tracking Program,,3,,LS_SPECIFIC
4.5.1.1,LS,,"Define requirements and business procedures for sample tracking, distribution, feedback, and reporting",,4,,LS_SPECIFIC
4.5.1.2,LS,,Define systems requirements for sample tracking,,4,,LS_SPECIFIC
4.5.1.3,LS,,Define systems requirements for sample distribution,,4,,LS_SPECIFIC
4.5.1.4,LS,,Define systems requirements for feedback and reporting on sample distribution,,4,,LS_SPECIFIC
4.5.1.5,LS,,Monitor sample stock levels,,4,,LS_SPECIFIC
4.6,LS,,Manage logistics and warehousing,,2,,LS_SPECIFIC
4.6.1,LS,,Provide logistics governance,,3,,LS_SPECIFIC
4.6.1.1,LS,,Translate customer service requirements into logistics requirements,,4,,LS_SPECIFIC
4.6.1.2,LS,,Design logistics network,,4,,LS_SPECIFIC
4.6.1.3,LS,,Communicate outsourcing needs,,4,,LS_SPECIFIC
4.6.1.4,LS,,Develop and maintain delivery service policy,,4,,LS_SPECIFIC
4.6.1.5,LS,,Optimize transportation schedules and costs,,4,,LS_SPECIFIC
4.6.1.6,LS,,Define key performance measures,,4,,LS_SPECIFIC
4.6.1.7,LS,,Define reverse logistics strategy,,4,,LS_SPECIFIC
4.6.2,LS,,Plan and manage inbound material flow,,3,,LS_SPECIFIC
4.6.2.1,LS,,Plan inbound material receipts,,4,,LS_SPECIFIC
4.6.2.2,LS,,Manage inbound material flow,,4,,LS_SPECIFIC
4.6.2.3,LS,,Monitor inbound delivery performance,,4,,LS_SPECIFIC
4.6.2.4,LS,,Manage flow of returned products,,4,,LS_SPECIFIC
4.6.2.5,LS,,Control quality of returned parts,,4,,LS_SPECIFIC
4.6.2.6,LS,,Salvage or repair returned products,,4,,LS_SPECIFIC
4.6.2.6.1,LS,,Perform salvage activities,,5,,LS_SPECIFIC
4.6.2.6.2,LS,,Manage repair/refurbishment and return to customer/stock,,5,,LS_SPECIFIC
4.6.3,LS,,Operate warehousing,,3,,LS_SPECIFIC
4.6.3.1,LS,,Track inventory deployment,,4,,LS_SPECIFIC
4.6.3.2,LS,,"Receive, inspect, and store inbound deliveries",,4,,LS_SPECIFIC
4.6.3.3,LS,,Track product availability,,4,,LS_SPECIFIC
4.6.3.4,LS,,"Pick, pack, and ship product for delivery",,4,,LS_SPECIFIC
4.6.3.5,LS,,Track inventory accuracy,,4,,LS_SPECIFIC
4.6.3.6,LS,,Track third-party logistics storage and shipping performance,,4,,LS_SPECIFIC
4.6.3.7,LS,,Manage physical finished goods inventory,,4,,LS_SPECIFIC
4.6.3.8,LS,,Manage warehouse transfers,,4,,LS_SPECIFIC
4.6.4,LS,,Operate outbound transportation,,3,,LS_SPECIFIC
4.6.4.1,LS,,"Plan, transport, and deliver outbound product",,4,,LS_SPECIFIC
4.6.4.2,LS,,Track carrier delivery performance,,4,,LS_SPECIFIC
4.6.4.3,LS,,Manage transportation fleet,,4,,LS_SPECIFIC
4.6.4.4,LS,,Process and audit carrier invoices and documents,,4,,LS_SPECIFIC
5.0,CI LS RT,Deliver Services,Deliver Services,Deliver Products,1,DIFFERENT,UNIVERSAL
5.1,CI LS RT,Establish service delivery governance and strategies,Establish service delivery governance and strategies,Operate warehouse,2,DIFFERENT,UNIVERSAL
5.1.1,CI LS RT,Establish service delivery governance,Establish service delivery governance,Plan warehouse layout and operations,3,DIFFERENT,UNIVERSAL
5.1.1.1,CI LS RT,Set up and maintain service delivery governance and management system,Set up and maintain service delivery governance and management system,Establish distribution planning constraints,4,DIFFERENT,UNIVERSAL
5.1.1.1.1,RT,,,Establish distribution center layout constraints,5,,RETAIL_SPECIFIC
5.1.1.1.2,RT,,,Establish inventory management constraints,5,,RETAIL_SPECIFIC
5.1.1.1.3,RT,,,Establish transportation management constraints,5,,RETAIL_SPECIFIC
5.1.1.2,CI LS RT,Manage service delivery performance,Manage service delivery performance,Determine product inventory requirements at destination,4,DIFFERENT,UNIVERSAL
5.1.1.3,CI LS RT,Manage service delivery development and direction,Manage service delivery development and direction,Plan inbound material receipts,4,DIFFERENT,UNIVERSAL
5.1.1.4,CI LS RT,Solicit feedback from customer on service delivery satisfaction,Solicit feedback from customer on service delivery satisfaction,Plan outbound product flow,4,DIFFERENT,UNIVERSAL
5.1.2,CI LS RT,Develop service delivery strategies,Develop service delivery strategies,Manage inventory,3,DIFFERENT,UNIVERSAL
5.1.2.1,CI LS RT,Define service delivery goals,Define service delivery goals,Plan inventory and replenishment levels,4,DIFFERENT,UNIVERSAL
5.1.2.10,RT,,,Track third-party logistics storage and shipping performance,4,,RETAIL_SPECIFIC
5.1.2.11,RT,,,Manage physical finished goods inventory,4,,RETAIL_SPECIFIC
5.1.2.12,RT,,,Prepare items/products for sale,4,,RETAIL_SPECIFIC
5.1.2.13,RT,,,Repackage items into SKUs,4,,RETAIL_SPECIFIC
5.1.2.2,CI LS RT,Define labor policies,Define labor policies,Track quantity and location of items,4,DIFFERENT,UNIVERSAL
5.1.2.3,CI LS RT,Evaluate resource availability,Evaluate resource availability,Determine lot numbering system,4,DIFFERENT,UNIVERSAL
5.1.2.4,CI LS RT,Define service delivery network and supply constraints,Define service delivery network and supply constraints,Determine lot usage,4,DIFFERENT,UNIVERSAL
5.1.2.5,CI LS RT,Define service delivery process,Define service delivery process,Track and manage lots and serial numbered items,4,DIFFERENT,UNIVERSAL
5.1.2.6,CI LS RT,Review and validate service delivery procedures,Review and validate service delivery procedures,Track inventory deployment,4,DIFFERENT,UNIVERSAL
5.1.2.7,CI LS RT,Define service delivery workplace layout and infrastructure,Define service delivery workplace layout and infrastructure,"Receive, inspect, and store inbound deliveries",4,DIFFERENT,UNIVERSAL
5.1.2.8,RT,,,Track product availability,4,,RETAIL_SPECIFIC
5.1.2.9,RT,,,Track inventory accuracy,4,,RETAIL_SPECIFIC
5.1.3,RT,,,Manage loading docks and yard,3,,RETAIL_SPECIFIC
5.1.3.1,RT,,,Analyze and forecast yard/dock traffic,4,,RETAIL_SPECIFIC
5.1.3.2,RT,,,Execute yard and dock schedules,4,,RETAIL_SPECIFIC
5.1.3.3,RT,,,Adjust schedules,4,,RETAIL_SPECIFIC
5.1.4,RT,,,"Pick, pack, and ship",3,,RETAIL_SPECIFIC
5.1.4.1,RT,,,Analyze product velocities,4,,RETAIL_SPECIFIC
5.1.4.2,RT,,,Develop pick plan/patterns,4,,RETAIL_SPECIFIC
5.1.4.3,RT,,,Generate pick lists and pick,4,,RETAIL_SPECIFIC
5.1.4.4,RT,,,Pack orders and apply shipping labels,4,,RETAIL_SPECIFIC
5.1.4.5,RT,,,Load trucks,4,,RETAIL_SPECIFIC
5.1.5,RT,,,Plan and manage workforce,3,,RETAIL_SPECIFIC
5.1.5.1,RT,,,Estimate workload,4,,RETAIL_SPECIFIC
5.1.5.2,RT,,,Schedule labor,4,,RETAIL_SPECIFIC
5.1.5.3,RT,,,Approve overtime,4,,RETAIL_SPECIFIC
5.1.5.4,RT,,,Assign and manage tasks,4,,RETAIL_SPECIFIC
5.1.5.5,RT,,,Monitor and adjust labor level,4,,RETAIL_SPECIFIC
5.1.6,RT,,,Manage returns,3,,RETAIL_SPECIFIC
5.1.6.1,RT,,,Authorize and process returns,4,,RETAIL_SPECIFIC
5.1.6.2,RT,,,Perform reverse logistics,4,,RETAIL_SPECIFIC
5.1.6.3,RT,,,Perform salvage activities,4,,RETAIL_SPECIFIC
5.1.6.4,RT,,,Manage and process warranty claims,4,,RETAIL_SPECIFIC
5.1.6.5,RT,,,Manage repair/refurbishment and return to customer/stock,4,,RETAIL_SPECIFIC
5.1.7,RT,,,Transfer product cross-dock,3,,RETAIL_SPECIFIC
5.2,CI LS RT,Manage service delivery resources,Manage service delivery resources,Manage transportation and logistics,2,DIFFERENT,UNIVERSAL
5.2.1,CI LS RT,Manage service delivery resource demand,Manage service delivery resource demand,Define distribution plan,3,DIFFERENT,UNIVERSAL
5.2.1.1,CI LS RT,Monitor pipeline,Monitor pipeline,Analyze sources and destinations of goods,4,DIFFERENT,UNIVERSAL
5.2.1.2,CI LS RT,Develop baseline forecasts,Develop baseline forecasts,Analyze average and peak goods flows and lead times,4,DIFFERENT,UNIVERSAL
5.2.1.3,CI LS RT,Collaborate with customers,Collaborate with customers,Identify and assess transportation and storage alternatives,4,DIFFERENT,UNIVERSAL
5.2.1.4,CI LS RT,Develop consensus forecast,Develop consensus forecast,Develop overall distribution plan,4,DIFFERENT,UNIVERSAL
5.2.1.5,CI LS RT,Determine availability of skills to deliver on current and forecast customer orders,Determine availability of skills to deliver on current and forecast customer orders,Assess performance and adjust plan,4,DIFFERENT,UNIVERSAL
5.2.1.6,CI LS,Monitor activity against forecast and revise forecast,Monitor activity against forecast and revise forecast,,4,CI_LS_MATCH,CI_LS_ONLY
5.2.1.7,CI LS,Evaluate and revise forecasting approach,Evaluate and revise forecasting approach,,4,CI_LS_MATCH,CI_LS_ONLY
5.2.1.8,CI LS,Measure forecast accuracy,Measure forecast accuracy,,4,CI_LS_MATCH,CI_LS_ONLY
5.2.2,CI LS RT,Create and manage resource plan,Create and manage resource plan,Plan transportation network,3,DIFFERENT,UNIVERSAL
5.2.2.1,CI LS RT,Define and manage skills taxonomy,Define and manage skills taxonomy,Assess current transportation network performance,4,DIFFERENT,UNIVERSAL
5.2.2.2,CI LS RT,Create resource plan,Create resource plan,Select transportation suppliers,4,DIFFERENT,UNIVERSAL
5.2.2.3,CI LS RT,"Match resource demand with capacity, skills, and capabilities","Match resource demand with capacity, skills, and capabilities",Negotiate contracts with transportation suppliers,4,DIFFERENT,UNIVERSAL
5.2.2.4,CI LS RT,Collaborate with suppliers and partners to supplement skills and capabilities,Collaborate with suppliers and partners to supplement skills and capabilities,Optimize transportation schedules and costs,4,DIFFERENT,UNIVERSAL
5.2.2.5,CI LS RT,Identify critical resources and supplier capacity,Identify critical resources and supplier capacity,Define key performance measures,4,DIFFERENT,UNIVERSAL
5.2.2.6,CI LS RT,Monitor and manage resource capacity and availability,Monitor and manage resource capacity and availability,Define routing policies,4,DIFFERENT,UNIVERSAL
5.2.3,CI LS RT,Enable service delivery resources,Enable service delivery resources,Plan and manage inbound product flow,3,DIFFERENT,UNIVERSAL
5.2.3.1,CI LS RT,Develop service delivery training plan,Develop service delivery training plan,Manage inbound product flow,4,DIFFERENT,UNIVERSAL
5.2.3.2,CI LS RT,Develop training materials,Develop training materials,Monitor inbound delivery performance,4,DIFFERENT,UNIVERSAL
5.2.3.3,CI LS RT,Manage training schedule,Manage training schedule,Manage flow of returned products,4,DIFFERENT,UNIVERSAL
5.2.3.4,CI LS,Deliver operations training,Deliver operations training,,4,CI_LS_MATCH,CI_LS_ONLY
5.2.3.5,CI LS,Deliver technical training,Deliver technical training,,4,CI_LS_MATCH,CI_LS_ONLY
5.2.3.6,CI LS,Perform skill and capability testing,Perform skill and capability testing,,4,CI_LS_MATCH,CI_LS_ONLY
5.2.3.7,CI LS,Evaluate training effectiveness,Evaluate training effectiveness,,4,CI_LS_MATCH,CI_LS_ONLY
5.2.4,RT,,,Manage imports/exports,3,,RETAIL_SPECIFIC
5.2.4.1,RT,,,Understand import/export laws and regulations,4,,RETAIL_SPECIFIC
5.2.4.2,RT,,,Establish import/export policies and procedures,4,,RETAIL_SPECIFIC
5.2.4.3,RT,,,Monitor import/export activities for compliance,4,,RETAIL_SPECIFIC
5.2.4.4,RT,,,Report and resolve violations,4,,RETAIL_SPECIFIC
5.2.5,RT,,,Operate outbound transportation,3,,RETAIL_SPECIFIC
5.2.5.1,RT,,,"Plan, transport, and deliver outbound product",4,,RETAIL_SPECIFIC
5.2.5.2,RT,,,Manage transportation fleet,4,,RETAIL_SPECIFIC
5.2.5.3,RT,,,Process and audit carrier invoices and documents,4,,RETAIL_SPECIFIC
5.2.5.4,RT,,,Plan carriers and routes,4,,RETAIL_SPECIFIC
5.2.5.5,RT,,,Contract transportation suppliers,4,,RETAIL_SPECIFIC
5.2.5.6,RT,,,Optimize backhaul opportunities,4,,RETAIL_SPECIFIC
5.2.6,RT,,,Track carrier performance,3,,RETAIL_SPECIFIC
5.3,CI LS RT,Deliver service to customer,Deliver service to customer,Manage enterprise inventory,2,DIFFERENT,UNIVERSAL
5.3.1,CI LS RT,Initiate service delivery,Initiate service delivery,Replenish retail stores,3,DIFFERENT,UNIVERSAL
5.3.1.1,CI LS RT,Review contract and agreed terms,Review contract and agreed terms,Monitor retail store inventory levels,4,DIFFERENT,UNIVERSAL
5.3.1.2,CI LS RT,Understand customer requirements and define refine approach,Understand customer requirements and define refine approach,Generate replenishment orders,4,DIFFERENT,UNIVERSAL
5.3.1.3,CI LS RT,Modify/revise and approve project plan,Modify/revise and approve project plan,Execute replenishment orders from warehouse,4,DIFFERENT,UNIVERSAL
5.3.1.4,CI LS,Review customer business objectives,Review customer business objectives,,4,CI_LS_MATCH,CI_LS_ONLY
5.3.1.5,CI LS,Confirm environmental readiness,Confirm environmental readiness,,4,CI_LS_MATCH,CI_LS_ONLY
5.3.1.6,CI LS,"Identify, select, and assign resources","Identify, select, and assign resources",,4,CI_LS_MATCH,CI_LS_ONLY
5.3.1.6.1,CI LS,Establish people objectives,Establish people objectives,,5,CI_LS_MATCH,CI_LS_ONLY
5.3.1.6.2,CI LS,Establish engagement rules,Establish engagement rules,,5,CI_LS_MATCH,CI_LS_ONLY
5.3.1.7,CI LS,Plan for service delivery,Plan for service delivery,,4,CI_LS_MATCH,CI_LS_ONLY
5.3.2,CI LS RT,Execute service delivery,Execute service delivery,Balance enterprise inventory,3,DIFFERENT,UNIVERSAL
5.3.2.1,CI LS RT,Analyze environment and customer needs,Analyze environment and customer needs,Allocate inventory to stores,4,DIFFERENT,UNIVERSAL
5.3.2.2,CI LS RT,Define solution,Define solution,Monitor and adjust inventory levels,4,DIFFERENT,UNIVERSAL
5.3.2.3,CI LS RT,Validate solution,Validate solution,Balance inventory to maximize sales,4,DIFFERENT,UNIVERSAL
5.3.2.4,CI LS RT,Identify changes,Identify changes,Manage ship from store and store pickup inventory levels,4,DIFFERENT,UNIVERSAL
5.3.2.5,CI LS RT,Obtain approval to proceed,Obtain approval to proceed,Manage pullbacks from stores,4,DIFFERENT,UNIVERSAL
5.3.2.6,CI LS,Make build/buy solution,Make build/buy solution,,4,CI_LS_MATCH,CI_LS_ONLY
5.3.2.7,CI LS,Deploy solution,Deploy solution,,4,CI_LS_MATCH,CI_LS_ONLY
5.3.3,CI LS RT,Complete service delivery,Complete service delivery,Replenish fulfillment centers,3,DIFFERENT,UNIVERSAL
5.3.3.1,CI LS RT,Conduct service delivery/project review and evaluate success,Conduct service delivery/project review and evaluate success,Monitor enterprise inventory levels,4,DIFFERENT,UNIVERSAL
5.3.3.2,CI LS RT,Complete/finalize financial management activities,Complete/finalize financial management activities,Generate purchase orders,4,DIFFERENT,UNIVERSAL
5.3.3.3,CI LS RT,Confirm delivery according to contract terms,Confirm delivery according to contract terms,Receive and distribute replenishment orders from suppliers,4,DIFFERENT,UNIVERSAL
5.3.3.4,CI LS,Release resources,Release resources,,4,CI_LS_MATCH,CI_LS_ONLY
5.3.3.5,CI LS,Manage service delivery completion,Manage service delivery completion,,4,CI_LS_MATCH,CI_LS_ONLY
5.3.3.6,CI LS,Harvest knowledge,Harvest knowledge,,4,CI_LS_MATCH,CI_LS_ONLY
5.3.3.7,CI LS,Archive records and update systems,Archive records and update systems,,4,CI_LS_MATCH,CI_LS_ONLY
5.4,RT,,,Manage direct-to-store-delivery,2,,RETAIL_SPECIFIC
6.0,CI LS RT,Manage Customer Service,Manage Customer Service,Deliver Services,1,DIFFERENT,UNIVERSAL
6.1,CI LS RT,Develop customer service strategy,Develop customer care/customer service strategy,Establish service delivery governance and strategies,2,DIFFERENT,UNIVERSAL
6.1.1,CI LS RT,Define customer service requirements across the enterprise,Define customer service requirements across the enterprise,Establish service delivery governance,3,DIFFERENT,UNIVERSAL
6.1.1.1,RT,,,Set up and maintain service delivery governance and management system,4,,RETAIL_SPECIFIC
6.1.1.2,RT,,,Manage service delivery performance,4,,RETAIL_SPECIFIC
6.1.1.3,RT,,,Manage service delivery development and direction,4,,RETAIL_SPECIFIC
6.1.1.4,RT,,,Solicit feedback from customer on service delivery satisfaction,4,,RETAIL_SPECIFIC
6.1.2,CI LS RT,Define customer service experience,Define customer service experience,Develop service delivery strategies,3,DIFFERENT,UNIVERSAL
6.1.2.1,RT,,,Define service delivery goals,4,,RETAIL_SPECIFIC
6.1.2.2,RT,,,Define labor policies,4,,RETAIL_SPECIFIC
6.1.2.3,RT,,,Evaluate resource availability,4,,RETAIL_SPECIFIC
6.1.2.4,RT,,,Define service delivery network and supply constraints,4,,RETAIL_SPECIFIC
6.1.2.5,RT,,,Define service delivery process,4,,RETAIL_SPECIFIC
6.1.2.6,RT,,,Review and validate service delivery procedures,4,,RETAIL_SPECIFIC
6.1.2.7,RT,,,Define service delivery workplace layout and infrastructure,4,,RETAIL_SPECIFIC
6.1.3,CI LS,Define and manage customer service channel strategy,Define and manage customer service channel strategy,,3,CI_LS_MATCH,CI_LS_ONLY
6.1.4,CI LS,Define customer service policies and procedures,Define customer service policies and procedures,,3,CI_LS_MATCH,CI_LS_ONLY
6.1.5,CI LS,Establish target service level for each customer segment,Establish target service level for each customer segment,,3,CI_LS_MATCH,CI_LS_ONLY
6.1.6,CI LS,Define warranty claims,Establish and manage plans to comply with HIPAA and other customer regulations,,3,DIFFERENT,CI_LS_ONLY
6.1.6.1,CI,Determine and document warranty policies,,,4,,CI_SPECIFIC
6.1.6.2,CI,Create and manage warranty rules/claim codes for products,,,4,,CI_SPECIFIC
6.1.6.3,CI,Agree on warranty responsibilities with suppliers,,,4,,CI_SPECIFIC
6.1.6.4,CI,Define warranty related offerings for customers,,,4,,CI_SPECIFIC
6.1.6.5,CI,Communicate warranty policies and offerings,,,4,,CI_SPECIFIC
6.1.7,CI LS,Develop recall strategy,Define warranty offering,,3,DIFFERENT,CI_LS_ONLY
6.1.7.1,LS,,Determine and document warranty policies,,4,,LS_SPECIFIC
6.1.7.2,LS,,Create and manage warranty rules/claim codes for products,,4,,LS_SPECIFIC
6.1.7.3,LS,,Agree on warranty responsibilities with suppliers,,4,,LS_SPECIFIC
6.1.7.4,LS,,Define warranty related offerings for customers,,4,,LS_SPECIFIC
6.1.7.5,LS,,Communicate warranty policies and offerings,,4,,LS_SPECIFIC
6.1.8,LS,,Develop recall strategy,,3,,LS_SPECIFIC
6.2,CI LS RT,Plan and manage customer service contacts,Plan and manage customer service contacts,Manage service delivery resources,2,DIFFERENT,UNIVERSAL
6.2.1,CI LS RT,Plan and manage customer service work force,Plan and manage customer service work force,Manage service delivery resource demand,3,DIFFERENT,UNIVERSAL
6.2.1.1,CI LS RT,Forecast volume of customer service contacts,Forecast volume of customer service contacts,Monitor pipeline,4,DIFFERENT,UNIVERSAL
6.2.1.2,CI LS RT,Schedule customer service work force,Schedule customer service work force,Develop baseline forecasts,4,DIFFERENT,UNIVERSAL
6.2.1.3,CI LS RT,Track work force utilization,Track work force utilization,Collaborate with customers,4,DIFFERENT,UNIVERSAL
6.2.1.4,CI LS RT,Monitor and evaluate quality of customer interactions with customer service representatives,Monitor and evaluate quality of customer interactions with customer service representatives,Develop consensus forecast,4,DIFFERENT,UNIVERSAL
6.2.1.5,RT,,,Determine availability of skills to deliver on current and forecast customer orders,4,,RETAIL_SPECIFIC
6.2.1.6,RT,,,Monitor activity against forecast and revise forecast,4,,RETAIL_SPECIFIC
6.2.1.7,RT,,,Evaluate and revise forecasting approach,4,,RETAIL_SPECIFIC
6.2.1.8,RT,,,Measure forecast accuracy,4,,RETAIL_SPECIFIC
6.2.2,CI LS RT,"Manage customer service problems, requests, and inquiries","Manage customer service problems, requests, and inquiries",Create and manage resource plan,3,DIFFERENT,UNIVERSAL
6.2.2.1,CI LS RT,"Receive customer problems, requests, and inquiries","Receive customer problems, requests, and inquiries",Define and manage skills taxonomy,4,DIFFERENT,UNIVERSAL
6.2.2.2,CI LS RT,"Analyze problems, requests, and inquiries","Analyze problems, requests, and inquiries",Create resource plan,4,DIFFERENT,UNIVERSAL
6.2.2.3,CI LS RT,"Resolve customer problems, requests, and inquiries","Resolve customer problems, requests, and inquiries","Match resource demand with capacity, skills, and capabilities",4,DIFFERENT,UNIVERSAL
6.2.2.4,CI LS RT,"Respond to customer problems, requests, and inquiries","Respond to customer problems, requests, and inquiries",Collaborate with suppliers and partners to supplement skills and capabilities,4,DIFFERENT,UNIVERSAL
6.2.2.5,CI LS RT,Identify and capture upsell/cross-sell opportunities,Identify and capture upsell/cross-sell opportunities,Identify critical resources and supplier capacity,4,DIFFERENT,UNIVERSAL
6.2.2.6,CI LS RT,Deliver opportunity to sales team,Deliver opportunity to sales team,Monitor and manage resource capacity and availability,4,DIFFERENT,UNIVERSAL
6.2.3,CI LS RT,Manage customer complaints,Manage customer complaints,Enable service delivery resources,3,DIFFERENT,UNIVERSAL
6.2.3.1,CI LS RT,Receive customer complaints,Receive customer complaints,Develop service delivery training plan,4,DIFFERENT,UNIVERSAL
6.2.3.2,CI LS RT,Route customer complaints,Route customer complaints,Develop training materials,4,DIFFERENT,UNIVERSAL
6.2.3.3,CI LS RT,Resolve customer complaints,Resolve customer complaints,Manage training schedule,4,DIFFERENT,UNIVERSAL
6.2.3.4,CI LS RT,Respond to customer complaints,Respond to customer complaints,Deliver operations training,4,DIFFERENT,UNIVERSAL
6.2.3.5,CI LS RT,Analyze customer complaints and response/redressal,Analyze customer complaints and response/redressal,Deliver technical training,4,DIFFERENT,UNIVERSAL
6.2.3.6,RT,,,Perform skill and capability testing,4,,RETAIL_SPECIFIC
6.2.3.7,RT,,,Evaluate training effectiveness,4,,RETAIL_SPECIFIC
6.2.4,CI LS,Process returns,"Report incidents, adverse events, and Corrective Action Preventive Action (CAPA)",,3,DIFFERENT,CI_LS_ONLY
6.2.4.1,CI LS,Authorize return,Identify incidents and adverse events,,4,DIFFERENT,CI_LS_ONLY
6.2.4.2,CI LS,Process return and record reason,Investigate incidents and adverse events,,4,DIFFERENT,CI_LS_ONLY
6.2.4.3,LS,,Resolve incidents and adverse events,,4,,LS_SPECIFIC
6.2.4.4,LS,,Report Corrective Action Preventive Action (CAPA),,4,,LS_SPECIFIC
6.2.4.5,LS,,Capture and report adverse events,,4,,LS_SPECIFIC
6.2.4.6,LS,,Perform and report trending analytics,,4,,LS_SPECIFIC
6.2.5,CI LS,Report incidents and risks to regulatory bodies,Manage medical inquiries,,3,DIFFERENT,CI_LS_ONLY
6.2.5.1,LS,,Receive medical inquiry,,4,,LS_SPECIFIC
6.2.5.2,LS,,Assign medical inquiry,,4,,LS_SPECIFIC
6.2.5.3,LS,,Track medical inquiry,,4,,LS_SPECIFIC
6.2.5.4,LS,,Respond to medical inquiry,,4,,LS_SPECIFIC
6.2.6,LS,,Authorize and manage product returns,,3,,LS_SPECIFIC
6.2.6.1,LS,,Receive return request,,4,,LS_SPECIFIC
6.2.6.2,LS,,Authorize return,,4,,LS_SPECIFIC
6.2.6.3,LS,,Submit return authorization to customer,,4,,LS_SPECIFIC
6.2.6.4,LS,,Verify receipt of return goods,,4,,LS_SPECIFIC
6.3,CI LS RT,Service products after sales,Service products after sales,Deliver service to customer,2,DIFFERENT,UNIVERSAL
6.3.1,CI LS RT,Register products,Register products,Initiate service delivery,3,DIFFERENT,UNIVERSAL
6.3.1.1,RT,,,Review contract and agreed terms,4,,RETAIL_SPECIFIC
6.3.1.2,RT,,,Understand customer requirements and define refine approach,4,,RETAIL_SPECIFIC
6.3.1.3,RT,,,Modify/revise and approve project plan,4,,RETAIL_SPECIFIC
6.3.1.4,RT,,,Review customer business objectives,4,,RETAIL_SPECIFIC
6.3.1.5,RT,,,Confirm environmental readiness,4,,RETAIL_SPECIFIC
6.3.1.6,RT,,,"Identify, select, and assign resources",4,,RETAIL_SPECIFIC
6.3.1.6.1,RT,,,Establish people objectives,5,,RETAIL_SPECIFIC
6.3.1.6.2,RT,,,Establish engagement rules,5,,RETAIL_SPECIFIC
6.3.1.7,RT,,,Plan for service delivery,4,,RETAIL_SPECIFIC
6.3.2,CI LS RT,Process warranty claims,Process warranty claims,Execute service delivery,3,DIFFERENT,UNIVERSAL
6.3.2.1,CI LS RT,Receive warranty claim,Receive warranty claim,Analyze environment and customer needs,4,DIFFERENT,UNIVERSAL
6.3.2.10,CI LS,Reconcile warranty transaction disposition,Reconcile warranty transaction disposition,,4,CI_LS_MATCH,CI_LS_ONLY
6.3.2.2,CI LS RT,Validate warranty claim,Validate warranty claim,Define solution,4,DIFFERENT,UNIVERSAL
6.3.2.3,CI LS RT,Investigate warranty issues,Investigate warranty issues,Validate solution,4,DIFFERENT,UNIVERSAL
6.3.2.3.1,CI LS,Define issue,Define issue,,5,CI_LS_MATCH,CI_LS_ONLY
6.3.2.3.2,CI LS,Schedule field service,Schedule field service,,5,CI_LS_MATCH,CI_LS_ONLY
6.3.2.3.3,CI LS,Request and receive defective part,Request and receive defective part,,5,CI_LS_MATCH,CI_LS_ONLY
6.3.2.3.4,CI LS,Investigate issue/perform root cause analysis,Investigate issue/perform root cause analysis,,5,CI_LS_MATCH,CI_LS_ONLY
6.3.2.3.5,CI LS,Receive investigation result/recommendation for corrective action,Receive investigation result/recommendation for corrective action,,5,CI_LS_MATCH,CI_LS_ONLY
6.3.2.4,CI LS RT,Determine responsible party,Determine responsible party,Identify changes,4,DIFFERENT,UNIVERSAL
6.3.2.5,CI LS RT,Manage pre-authorizations,Manage pre-authorizations,Obtain approval to proceed,4,DIFFERENT,UNIVERSAL
6.3.2.6,CI LS RT,Approve or reject warranty claim,Approve or reject warranty claim,Make build/buy solution,4,DIFFERENT,UNIVERSAL
6.3.2.7,CI LS RT,Notify originator of approve/reject decision,Notify originator of approve/reject decision,Deploy solution,4,DIFFERENT,UNIVERSAL
6.3.2.8,CI LS,Authorize payment,Authorize payment,,4,CI_LS_MATCH,CI_LS_ONLY
6.3.2.9,CI LS,Close claim,Close claim,,4,CI_LS_MATCH,CI_LS_ONLY
6.3.3,CI LS RT,Manage supplier recovery,Manage supplier recovery,Complete service delivery,3,DIFFERENT,UNIVERSAL
6.3.3.1,CI LS RT,Create supplier recovery claims,Create supplier recovery claims,Conduct service delivery/project review and evaluate success,4,DIFFERENT,UNIVERSAL
6.3.3.2,CI LS RT,Negotiate recoveries with suppliers,Negotiate recoveries with suppliers,Complete/finalize financial management activities,4,DIFFERENT,UNIVERSAL
6.3.3.3,RT,,,Confirm delivery according to contract terms,4,,RETAIL_SPECIFIC
6.3.3.4,RT,,,Release resources,4,,RETAIL_SPECIFIC
